[
  {
    "dish_id": "dish-amala-ewedu",
    "name": "Amala and Ewedu",
    "local_names": {
      "en": "Amala and Ewedu",
      "pcm": "Amala and Ewedu",
      "yo": "Àmàlà àti Ewédú",
      "ig": "Amala na Ewedu",
      "ha": "Amala da Ewedu"
    },
    "region": ["southwest"],
    "tags": ["swallow", "yam", "leafy", "traditional", "yoruba"],
    "spice_level": 4,
    "category": "swallow",
    "common_pairings": ["Gbegiri", "Stew", "Ponmo", "Fish", "Meat"],
    "dietary_flags": ["vegetarian", "gluten_free"],
    "source_ref": "CURATED-Yoruba-Traditional",
    "needs_native_review": true,
    "notes": "Spice level varies by buka; Ewedu is naturally mild but served with spicy stew"
  },
  {
    "dish_id": "dish-eba-egusi",
    "name": "Eba and Egusi Soup",
    "local_names": {
      "en": "Eba and Egusi Soup",
      "pcm": "Eba and Egusi",
      "yo": "Ẹ̀bà àti Egusi",
      "ig": "Eba na Egusi",
      "ha": "Eba da Egusi"
    },
    "region": ["southwest", "southsouth", "southeast", "northcentral"],
    "tags": ["swallow", "cassava", "melon_seed", "protein_rich", "nationwide"],
    "spice_level": 3,
    "category": "swallow",
    "common_pairings": ["Ponmo", "Stockfish", "Dry Fish", "Ugu Leaves", "Bitter Leaf"],
    "dietary_flags": ["gluten_free"],
    "source_ref": "CURATED-Pan-Nigerian",
    "needs_native_review": true,
    "notes": "Egusi preparation varies regionally (Yoruba vs Igbo vs Delta style)"
  },
  {
    "dish_id": "dish-pounded-yam-egusi",
    "name": "Pounded Yam and Egusi",
    "local_names": {
      "en": "Pounded Yam and Egusi Soup",
      "pcm": "Pounded Yam and Egusi",
      "yo": "Iyán àti Egusi",
      "ig": "Nni Ji na Egusi",
      "ha": "Tuwon Yam da Egusi"
    },
    "region": ["southwest", "southsouth", "southeast", "northcentral"],
    "tags": ["swallow", "yam", "melon_seed", "celebratory", "premium"],
    "spice_level": 3,
    "category": "swallow",
    "common_pairings": ["Bushmeat", "Stockfish", "Ponmo", "Ugu", "Bitter Leaf"],
    "dietary_flags": ["gluten_free"],
    "source_ref": "CURATED-Pan-Nigerian",
    "needs_native_review": true,
    "notes": "Considered premium; pounded yam texture is critical quality marker"
  },
  {
    "dish_id": "dish-tuwo-shinkafa-miyan-kuka",
    "name": "Tuwo Shinkafa and Miyan Kuka",
    "local_names": {
      "en": "Tuwo Shinkafa and Miyan Kuka",
      "pcm": "Tuwo Shinkafa and Miyan Kuka",
      "yo": "Tuwo Shinkafa ati Miyan Kuka",
      "ig": "Tuwo Shinkafa na Miyan Kuka",
      "ha": "Tuwo Shinkafa da Miyan Kuka"
    },
    "region": ["northwest", "northeast", "northcentral"],
    "tags": ["swallow", "rice", "baobab_leaf", "northern", "hausa_fulani"],
    "spice_level": 2,
    "category": "swallow",
    "common_pairings": ["Kilishi", "Suya", "Daddawa", "Yaji", "Fura"],
    "dietary_flags": ["halal", "gluten_free", "vegetarian"],
    "source_ref": "CURATED-Northern-Traditional",
    "needs_native_review": true,
    "notes": "Miyan Kuka (baobab leaf soup) is distinctly Northern; mild spice profile"
  },
  {
    "dish_id": "dish-tuwo-masara-miyan-taushe",
    "name": "Tuwo Masara and Miyan Taushe",
    "local_names": {
      "en": "Tuwo Masara and Miyan Taushe",
      "pcm": "Tuwo Masara and Miyan Taushe",
      "yo": "Tuwo Masara ati Miyan Taushe",
      "ig": "Tuwo Masara na Miyan Taushe",
      "ha": "Tuwo Masara da Miyan Taushe"
    },
    "region": ["northwest", "northeast", "northcentral"],
    "tags": ["swallow", "maize", "pumpkin", "northern", "hausa_fulani"],
    "spice_level": 2,
    "category": "swallow",
    "common_pairings": ["Suya", "Kilishi", "Daddawa", "Yaji"],
    "dietary_flags": ["halal", "vegetarian"],
    "source_ref": "CURATED-Northern-Traditional",
    "needs_native_review": true,
    "notes": "Tuwo Masara is cornmeal swallow; Miyan Taushe is pumpkin soup"
  },
  {
    "dish_id": "dish-fufu-oha",
    "name": "Fufu and Oha Soup",
    "local_names": {
      "en": "Fufu and Oha Soup",
      "pcm": "Fufu and Oha",
      "yo": "Fufu ati Oha",
      "ig": "Akpu na Oha",
      "ha": "Fufu da Oha"
    },
    "region": ["southeast"],
    "tags": ["swallow", "cassava_fermented", "oha_leaf", "igbo", "traditional"],
    "spice_level": 3,
    "category": "swallow",
    "common_pairings": ["Stockfish", "Dry Fish", "Ponmo", "Cocoyam", "Uziza"],
    "dietary_flags": ["gluten_free"],
    "source_ref": "CURATED-Igbo-Traditional",
    "needs_native_review": true,
    "notes": "Oha leaves (Pterocarpus mildbraedii) are distinct from bitter leaf; seasonal"
  },
  {
    "dish_id": "dish-fufu-onugbu",
    "name": "Fufu and Ofe Onugbu (Bitter Leaf Soup)",
    "local_names": {
      "en": "Fufu and Bitter Leaf Soup",
      "pcm": "Fufu and Bitter Leaf",
      "yo": "Fufu ati Ewuro",
      "ig": "Akpu na Onugbu",
      "ha": "Fufu da Bitter Leaf"
    },
    "region": ["southeast", "southsouth"],
    "tags": ["swallow", "cassava_fermented", "bitter_leaf", "igbo", "traditional"],
    "spice_level": 3,
    "category": "swallow",
    "common_pairings": ["Stockfish", "Dry Fish", "Ponmo", "Cocoyam", "Ogiri"],
    "dietary_flags": ["gluten_free"],
    "source_ref": "CURATED-Igbo-Traditional",
    "needs_native_review": true,
    "notes": "Bitterness level is a quality marker; properly washed onugbu retains slight bitterness"
  },
  {
    "dish_id": "dish-akpu-banga",
    "name": "Akpu and Banga Soup",
    "local_names": {
      "en": "Akpu and Banga Soup",
      "pcm": "Akpu and Banga",
      "yo": "Akpu ati Banga",
      "ig": "Akpu na Banga",
      "ha": "Akpu da Banga"
    },
    "region": ["southsouth", "southeast"],
    "tags": ["swallow", "cassava_fermented", "palm_nut", "delta", "efik", "ibibio"],
    "spice_level": 4,
    "category": "swallow",
    "common_pairings": ["Fresh Fish", "Periwinkle", "Stockfish", "Starch", "Ugu"],
    "dietary_flags": ["gluten_free"],
    "source_ref": "CURATED-Delta-Traditional",
    "needs_native_review": true,
    "notes": "Banga (palm nut soup) is distinct from Ofe Akwu; spicier, more aromatic"
  },
  {
    "dish_id": "dish-starch-banga",
    "name": "Starch (Usi) and Banga Soup",
    "local_names": {
      "en": "Starch and Banga Soup",
      "pcm": "Starch and Banga",
      "yo": "Starch ati Banga",
      "ig": "Usi na Banga",
      "ha": "Starch da Banga"
    },
    "region": ["southsouth"],
    "tags": ["swallow", "cassava_starch", "palm_nut", "delta", "efik", "ibibio"],
    "spice_level": 4,
    "category": "swallow",
    "common_pairings": ["Fresh Fish", "Periwinkle", "Stockfish", "Ugu", "Scent Leaf"],
    "dietary_flags": ["gluten_free"],
    "source_ref": "CURATED-Delta-Traditional",
    "needs_native_review": true,
    "notes": "Starch (Usi) is fermented cassava starch; yellow from palm oil"
  },
  {
    "dish_id": "dish-eba-okra",
    "name": "Eba and Okra Soup",
    "local_names": {
      "en": "Eba and Okra Soup",
      "pcm": "Eba and Okro",
      "yo": "Ẹ̀bà àti Ilá",
      "ig": "Eba na Okwuru",
      "ha": "Eba da Okro"
    },
    "region": ["southwest", "southsouth", "southeast", "northcentral"],
    "tags": ["swallow", "cassava", "okra", "slimy", "quick_meal"],
    "spice_level": 3,
    "category": "swallow",
    "common_pairings": ["Ponmo", "Fish", "Meat", "Ugu", "Ogiri"],
    "dietary_flags": ["gluten_free", "vegetarian"],
    "source_ref": "CURATED-Pan-Nigerian",
    "needs_native_review": false,
    "notes": "Okra soup texture (draw) is key quality indicator"
  },
  {
    "dish_id": "dish-amala-gbegiri",
    "name": "Amala and Gbegiri (Bean Soup)",
    "local_names": {
      "en": "Amala and Gbegiri",
      "pcm": "Amala and Gbegiri",
      "yo": "Àmàlà àti Gbègírí",
      "ig": "Amala na Gbegiri",
      "ha": "Amala da Gbegiri"
    },
    "region": ["southwest"],
    "tags": ["swallow", "yam", "beans", "yoruba", "protein_rich"],
    "spice_level": 3,
    "category": "swallow",
    "common_pairings": ["Ewedu", "Stew", "Ponmo", "Ogi"],
    "dietary_flags": ["vegetarian", "gluten_free"],
    "source_ref": "CURATED-Yoruba-Traditional",
    "needs_native_review": true,
    "notes": "Often served as Abula (Gbegiri + Ewedu combined); beans must be well-cooked and smooth"
  },
  {
    "dish_id": "dish-semolina-egusi",
    "name": "Semolina and Egusi Soup",
    "local_names": {
      "en": "Semolina and Egusi Soup",
      "pcm": "Semovita and Egusi",
      "yo": "Semolina ati Egusi",
      "ig": "Semolina na Egusi",
      "ha": "Semolina da Egusi"
    },
    "region": ["nationwide"],
    "tags": ["swallow", "wheat", "melon_seed", "modern", "quick_meal"],
    "spice_level": 3,
    "category": "swallow",
    "common_pairings": ["Stockfish", "Ponmo", "Ugu", "Bitter Leaf"],
    "dietary_flags": [],
    "source_ref": "CURATED-Modern-Nigerian",
    "needs_native_review": false,
    "notes": "Semovita/Semolina is the modern quick-cook alternative to pounded yam/eba"
  },
  {
    "dish_id": "dish-jollof-rice",
    "name": "Nigerian Jollof Rice",
    "local_names": {
      "en": "Jollof Rice",
      "pcm": "Jollof",
      "yo": "Jollof",
      "ig": "Jollof",
      "ha": "Jollof"
    },
    "region": ["nationwide"],
    "tags": ["rice", "tomato", "party", "celebratory", "nationwide", "owambe"],
    "spice_level": 3,
    "category": "rice",
    "common_pairings": ["Fried Plantain", "Moi Moi", "Chicken", "Beef", "Salad", "Coleslaw"],
    "dietary_flags": [],
    "source_ref": "CURATED-Pan-Nigerian",
    "needs_native_review": false,
    "notes": "The 'Party Jollof' (smoky bottom-pot) is distinct from home-style"
  },
  {
    "dish_id": "dish-fried-rice",
    "name": "Nigerian Fried Rice",
    "local_names": {
      "en": "Fried Rice",
      "pcm": "Fried Rice",
      "yo": "Iresi Dindin",
      "ig": "Osa Dindin",
      "ha": "Shinkafa Dindin"
    },
    "region": ["nationwide"],
    "tags": ["rice", "vegetables", "party", "celebratory", "mixed_veg"],
    "spice_level": 2,
    "category": "rice",
    "common_pairings": ["Chicken", "Beef", "Plantain", "Moi Moi", "Salad"],
    "dietary_flags": [],